[
    {
        "id": 0,
        "name": "237Builds",
        "category": "community",
        "location": "Bamenda",
        "startDate": "2025",
        "description": "An online platform and community showcasing Cameroon's tech ecosystem, startups, and resources to foster growth and collaboration.",
        "website": "https://237-builds.netlify.app",
        "logo": "https://i.ibb.co/wrCmwsZ1/20250910-0117-Tech-Logo-Design-simple-compose-01k4rfm7tae22ateav6m7jhejh.png"
    },
     {
    "id": 1,
    "name": "Innovate with SEED",
    "category": "edtech" ,
    "location": "Bamenda",
    "startDate": "2024",
    "description": "Innovate with SEED is a Bamenda-based IT training institute in Cameroon offering hands-on tech education programs, bootcamps, and community events to empower the next generation of African innovators through practical learning.",
    "website": "https://innovatewithseed.com",
    "logo": "/public/seed.svg"
},

    {
        "id": 2,
        "name": "Freshbag",
        "category": "agritech",
        "location": "Yaounde",
        "startDate": "2019",
        "description": "A digital marketplace and distribution platform connecting small-scale farmers to customers across Cameroon.",
        "website": "https://freshbag.shop",
        "logo": "https://i.ibb.co/sdSV0tm0/freshbag.png"
    },
   
   
    {
        "id": 3,
        "name": "Findie",
        "category": "edtech",
        "location": "Buea",
        "startDate": "2020",
        "description": "A mobile app for University of Buea students to navigate campus and access important academic information and locations.",
        "website": "https://findieub.web.app",
        "logo": "https://i.ibb.co/B53LJYpV/Findie-removebg-preview.png"
    },
    {
        "id": 4,
        "name": "Concour Guide CMR",
        "category": "edtech",
        "location": "Buea",
        "startDate": "2020",
        "description": "An educational app providing past entrance exam questions and career guidance to help Cameroonian students prepare for competitive exams.",
        "website": "https://concourguide-cmr.web.app",
        "logo": "https://i.ibb.co/pBwXs6Pr/concours.png"
    },
    {
        "id": 5,
        "name": "Digolearn",
        "category": "edtech",
        "location": "Buea",
        "startDate": "2020",
        "description": "An online learning platform offering virtual schooling tools, school management software, and an academic community for schools and students.",
        "website": "https://digolearn.com",
        "logo": "https://i.ibb.co/39r0pWv0/digolearn.png"
    },
     {
        "id": 6,
        "name": "Aleigro Online Shopping Mall",
        "category": "ecommerce",
        "location": "Buea",
        "startDate": "2020",
        "description": "Cameroon’s first online shopping mall, aggregating products from multiple local merchants into one app for consumers.",
        "website": "https://aleigro.com",
        "logo": "https://i.ibb.co/xSDRyQSM/aleigro.png"
    },
    {
        "id": 7,
        "name": "Data Girl Technologies",
        "category": "edtech",
        "location": "Buea",
        "startDate": "2020",
        "description": "A tech education initiative providing coding bootcamps, mentorship, and networking to empower young women and girls in Cameroon in STEM fields.",
        "website": "https://datagirltech.com",
        "logo": "https://i.ibb.co/Kjwhjx2T/DG.png"
    },
    {
        "id": 8,
        "name": "Ejara",
        "category": "fintech",
        "location": "Douala",
        "startDate": "2020",
        "description": "A mobile investment platform enabling users to invest via their mobile money account in crypto and stocks, with interest-bearing savings plans.",
        "website": "https://ejara.io",
        "logo": "https://i.ibb.co/4RMbLmH9/ejara.png"
    },
    {
        "id": 9,
        "name": "PaySika",
        "category": "fintech",
        "location": "Douala",
        "startDate": "2020",
        "description": "A neo-bank service operating through messaging platforms, offering free accounts and virtual cards with no fees or minimum balance requirements.",
        "website": "https://www.paysika.co",
        "logo": "https://i.ibb.co/gM8NCkWw/paysika.png"
    },
    {
        "id": 10,
        "name": "Nkwa",
        "category": "fintech",
        "location": "Buea",
        "startDate": "2020",
        "description": "A licensed savings app helping users set and achieve financial goals with features like goal reminders and locked savings wallets for future needs.",
        "website": "https://mynkwa.com",
        "logo": "https://i.ibb.co/WWGrSKJd/Nkwa.png"
    },
    {
        "id": 11,
        "name": "Bohikor",
        "category": "fintech",
        "location": "Buea",
        "startDate": "2020",
        "description": "A personal finance mobile app that teaches budgeting and expense tracking to salary earners, helping them manage and optimize their spending habits.",
        "website": "https://www.linkedin.com/company/bohikor/?originalSubdomain=cm",
        "logo": "https://i.ibb.co/mgd7D3S/bohiko.png"
    },
  
    {
        "id": 13,
        "name": "Waspito",
        "category": "healthtech",
        "location": "Douala",
        "startDate": "2020",
        "description": "A telemedicine app connecting patients with certified doctors for video consultations, digital prescriptions, and access to nearby labs and pharmacies.",
        "website": "https://www.waspito.com",
        "logo": "https://i.ibb.co/4gNHSWSq/waspito.png"
    },
    {
        "id": 14,
        "name": "Zitopay",
        "category": "fintech",
        "location": "Limbe",
        "startDate": "2020",
        "description": "An online payment gateway and marketplace simplifying payments for businesses of all sizes, enabling multi-channel transactions via web, WhatsApp, or SMS.",
        "website": "https://zitopay.africa",
        "logo": "https://i.ibb.co/C3MQSnFD/zitopay.png"
    },
    {
        "id": 15,
        "name": "Fapshi",
        "category": "fintech",
        "location": "Buea",
        "startDate": "2021",
        "description": "A payments infrastructure startup offering easy-to-integrate APIs, payment links, and pre-built checkout solutions for websites, apps, and events.",
        "website": "https://www.fapshi.com",
        "logo": "https://i.ibb.co/G3CjTYt5/Fapshi.png"
    },
    {
        "id": 16,
        "name": "Campay",
        "category": "fintech",
        "location": "Yaounde",
        "startDate": "2021",
        "description": "A mobile money gateway enabling Cameroonian businesses to accept MTN and Orange mobile money payments seamlessly, with fast payouts and flexible integration.",
        "website": "https://www.campay.net",
        "logo": "https://i.ibb.co/ZRXx4XqS/CamPay.png"
    },
    {
        "id": 17,
        "name": "Traleor",
        "category": "technology",
        "location": "Buea",
        "startDate": "2021",
        "description": "A no-code website builder for African SMEs and entrepreneurs, allowing users to create and host fully optimized websites without any programming.",
        "website": "https://traleor.com",
        "logo": "https://i.ibb.co/xtxQ1Lhp/traleor.png"
    },
    {
        "id": 18,
        "name": "OnDjoss",
        "category": "technology",
        "location": "Yaounde",
        "startDate": "2019",
        "description": "A feature-rich messaging app built by Cameroonians, offering free chats, voice messages, group calls, file sharing, and unlimited cloud storage.",
        "website": "https://www.ondjoss.com",
        "logo": "https://i.ibb.co/B21sfxR0/Onjoss.png"
    },
    {
        "id": 19,
        "name": "Taaply",
        "category": "technology",
        "location": "Douala",
        "startDate": "2019",
        "description": "A networking platform that lets users create and exchange digital business cards instantly via NFC, eliminating the need for paper cards.",
        "website": "https://taaply.com",
        "logo": "https://i.ibb.co/xSCDqnMb/Taaply.png"
    },
    {
        "id": 20,
        "name": "Gozem",
        "category": "transport",
        "location": "Douala",
        "startDate": "2018",
        "description": "A regional on-demand super-app offering motorcycle and car rides, as well as food and grocery delivery, primarily serving West and Central African markets.",
        "website": "https://gozem.co",
        "logo": "https://i.ibb.co/8Ln0RRVT/GOZEM.png"
    },
    {
        "id": 21,
        "name": "Agri Hub Technologies",
        "category": "agritech",
        "location": "Buea",
        "startDate": "2018",
        "description": "An agri-tech company that bridges farmers with urban buyers, providing improved inputs, training, and farm management solutions to boost productivity.",
        "website": "https://agrichubtech.com",
        "logo": "https://i.ibb.co/HT19FQkF/agritech.png"
    },
    {
        "id": 22,
        "name": "AgricFresh",
        "category": "agritech",
        "location": "Foumbot",
        "startDate": "2023",
        "description": "Develops solar-powered cold-storage units and an online marketplace to reduce post-harvest losses, improving shelf-life and direct farmer-to-buyer linkages.",
        "website": "https://agricfresh.cm",
        "logo": "https://i.ibb.co/q3rqKFrL/Agrifresh.png"
    },
    {
        "id": 23,
        "name": "AgrixTech",
        "category": "agritech",
        "location": "Yaounde",
        "startDate": "2018",
        "description": "An AI-powered agritech platform that diagnoses crop diseases from photos and provides sustainable farming advice to help smallholder farmers increase yields.",
        "website": "https://www.agrixtech.com",
        "logo": "https://i.ibb.co/r2cPr6fw/Agrix-Tech.png"
    },
    {
        "id": 24,
        "name": "Koree",
        "category": "fintech",
        "location": "Douala",
        "startDate": "2022",